{
  "schema_version": 1,
  "id": "ZOO-ISSUE-25",
  "asset": "Zoodo",
  "source_issue": "https://github.com/london4216-hue/Zoodo/issues/25",
  "intent": "Preserve Prestige demo baseline; independently develop a separate UI/UX comparison and evidence-backed client feedback without inventing deployed URLs",
  "source_title": "P0: Sora-inspired Prestige student demo redesign, live comparison and client feedback scorecard",
  "dependencies": [],
  "priority": "P0",
  "status": "ready",
  "claim_lease": {
    "holder": null,
    "lease_id": null,
    "acquired_at": null,
    "expires_at": null
  },
  "assigned_agent": null,
  "branch": null,
  "pr": null,
  "associated_prs": [],
  "commit_sha": null,
  "tests": {
    "status": "UNKNOWN",
    "receipts": []
  },
  "deployment": {
    "status": "UNKNOWN",
    "url": null,
    "deploy_id": null,
    "sha": null
  },
  "timestamps": {
    "source_created_at": "2026-10-30T23:37:15Z",
    "source_updated_at": "2026-10-30T23:39:01Z",
    "claimed_at": null,
    "first_commit_at": null,
    "pr_opened_at": null,
    "merged_at": null,
    "deployed_at": null,
    "verified_at": null
  },
  "evidence_receipts": [],
  "next_action": "Inventory original Prestige demo/source and routes; create isolated concept branch; verify functional parity and mobile before any authorized separate publication.",
  "source_snapshot_observed_at": "2026-10-30T23:39:20.043Z"
}
