{
  "schema_version": 1,
  "id": "ZOO-ISSUE-18",
  "asset": "Zoodo",
  "source_issue": "https://github.com/london4216-hue/Zoodo/issues/18",
  "intent": "out-of-browser watchdog and stale→recovery drill",
  "source_title": "P0: ZOO AUTO-ROUTE — unattended watchdog, no single-agent roadblocks",
  "dependencies": [],
  "priority": "P0",
  "status": "ready",
  "claim_lease": {
    "holder": null,
    "lease_id": null,
    "acquired_at": null,
    "expires_at": null
  },
  "assigned_agent": null,
  "branch": null,
  "pr": null,
  "associated_prs": [
    "https://github.com/london4216-hue/Zoodo/pull/19",
    "https://github.com/london4216-hue/Zoodo/pull/20"
  ],
  "commit_sha": null,
  "tests": {
    "status": "UNKNOWN",
    "receipts": []
  },
  "deployment": {
    "status": "UNKNOWN",
    "url": null,
    "deploy_id": null,
    "sha": null
  },
  "timestamps": {
    "source_created_at": "2026-10-30T16:33:10Z",
    "source_updated_at": "2026-10-30T23:26:40Z",
    "claimed_at": null,
    "first_commit_at": null,
    "pr_opened_at": null,
    "merged_at": null,
    "deployed_at": null,
    "verified_at": null
  },
  "evidence_receipts": [],
  "next_action": "out-of-browser watchdog and stale→recovery drill",
  "source_snapshot_observed_at": "2026-10-30T23:30:37.622Z"
}
