{
  "schema_version": 1,
  "id": "ZOO-ISSUE-7",
  "asset": "Zoodo",
  "source_issue": "https://github.com/london4216-hue/Zoodo/issues/7",
  "intent": "prove two actual claimed tickets and qualified independent failover",
  "source_title": "P0: Deploy and prove working multi-agent army + free/open-source failover across all owned projects",
  "dependencies": [
    "ZOO-ISSUE-8"
  ],
  "priority": "P0",
  "status": "blocked",
  "claim_lease": {
    "holder": null,
    "lease_id": null,
    "acquired_at": null,
    "expires_at": null
  },
  "assigned_agent": null,
  "branch": null,
  "pr": null,
  "associated_prs": [],
  "commit_sha": null,
  "tests": {
    "status": "UNKNOWN",
    "receipts": []
  },
  "deployment": {
    "status": "UNKNOWN",
    "url": null,
    "deploy_id": null,
    "sha": null
  },
  "timestamps": {
    "source_created_at": "2026-10-30T06:33:28Z",
    "source_updated_at": "2026-10-30T06:39:03Z",
    "claimed_at": null,
    "first_commit_at": null,
    "pr_opened_at": null,
    "merged_at": null,
    "deployed_at": null,
    "verified_at": null
  },
  "evidence_receipts": [],
  "next_action": "prove two actual claimed tickets and qualified independent failover",
  "source_snapshot_observed_at": "2026-10-30T23:30:37.622Z"
}
